{
  "$schema": "https://json-schema.org/draft/2020-12/schema",
  "$id": "https://in-dire-straits.space/data/schemas/characters/character.schema.json",
  "title": "Character",
  "description": "A character in a Role Playing Game.",
  "type": "object",
  "properties": {
    "type": {
      "description": "The type of thingy the data describes, 'character'.",
      "type": "string",
      "const": "character"
    },
    "schemaVersion": {
      "description": "The version of the schema for the data.",
      "type": "string",
      "const": "1"
    },
    "id": {
      "title": "ID",
      "description": "Unique identifier for the character.",
      "type": "string"
    },
    "name": {
      "title": "Name",
      "description": "The name of the character.",
      "type": "string"
    },
    "playerName": {
      "description": "The name of the player of the character.",
      "type": "string"
    },
    "campaigns": {
      "title": "Campaigns",
      "description": "A list of campaign IDs this character is in.",
      "type": "array",
      "items": {
        "type": "string",
        "title": "Campaign ID",
        "description": "The IDs of the campaigns the character is in."
      }
    },
    "description": {
      "description": "The description of the character, Markdown allowed.",
      "type": "string"
    },
    "characterType": {
      "title": "Character type",
      "description": "The type of character, PC, NPC, Mob, Ship, etc.",
      "type": "string",
      "enum": [
        "PC",
        "NPC",
        "ship",
        "mob"
      ]
    },
    "refresh": {
      "description": "The current minimum number of Fate points the player of this character starts with at the beginning of a session.",
      "type": "integer",
      "minimum": 1,
      "default": 3
    },
    "fatePoints": {
      "description": "The current number of Fate points the player of this character currently has.",
      "type": "integer",
      "minimum": 0,
      "default": 3
    },
    "aspects": {
      "description": "The Aspects describing the character.",
      "type": "array",
      "items": {
        "type": "object",
        "properties": {
          "aspectType": {
            "description": "The type of Aspect",
            "type": "string",
            "enum": [
              "High Concept",
              "Trouble",
              "Relationship",
              "Reason to Race",
              "Oneshot Reason",
              "Other"
            ]
          },
          "name": {
            "description": "The name of the Aspect",
            "type": "string"
          },
          "description": {
            "description": "A description of the Aspect, giving a little more context, Markdown allowed.",
            "type": "string"
          },
          "freeInvokes": {
            "type": "number",
            "description": "How many Free Invokes are currently on the Aspect",
            "minimum": 0,
            "default": 0
          }
        },
        "required": [
          "name"
        ]
      }
    },
    "images": {
      "description": "A list of images representing the character, to be included on the character's sheet.",
      "title": "Character Images",
      "type": "array",
      "items": {
        "description": "The details about an image.",
        "title": "Image",
        "type": "object",
        "properties": {
          "uri": {
            "type": "string",
            "description": "The URI of an image.",
            "title": "Image URI"
          },
          "caption": {
            "description": "The caption to be displayed with the image.",
            "title": "Image Caption",
            "type": "string"
          }
        },
        "required": [
          "uri"
        ]
      },
      "minItems": 1
    },
    "traitType": {
      "type": "string",
      "description": "The type of the properties of the character used as a bonus on a dice roll to resolve actions.",
      "enum": [
        "skill",
        "approach",
        "profession",
        "other"
      ]
    },
    "traits": {
      "type": "array",
      "items": {
        "type": "object",
        "properties": {
          "name": {
            "type": "string",
            "description": "The name of the trait, like 'Notice', 'Careful', or 'Warrior'"
          },
          "rank": {
            "type": "integer",
            "description": "The bonus applied to a resolution roll when this trait is applicable.",
            "minimum": 0
          }
        },
        "required": [
          "name",
          "rank"
        ]
      }
    },
    "stunts": {
      "type": "array",
      "description": "A list of the stunts the character can use.",
      "items": {
        "$ref": "https://in-dire-straits.space/data/schemas/characters/stunt.schema.json"
      }
    },
    "tracks": {
      "type": "array",
      "description": "The data structures used to track the current state of the character.",
      "items": {
        "type": "object",
        "properties": {
          "trackId": {
            "type": "string",
            "description": "A unique identifier for this track on the character to which it is tied."
          },
          "trackLabel": {
            "type": "string",
            "description": "The label or title for this track."
          },
          "showSoakAmount": {
            "type": "boolean",
            "description": "Should the amount of soak the boxes in this track be displayed to the user?"
          },
          "boxes": {
            "type": "array",
            "items": {
              "type": "object",
              "properties": {
                "isUsed": {
                  "type": "boolean",
                  "description": "Has the box been used to soak shifts of effect?"
                },
                "soakValue": {
                  "type": "number",
                  "description": "How many shifts of effect the box can soak."
                }
              },
              "required": [
                "isUsed",
                "soakValue"
              ]
            }
          },
          "aspect": {
            "type": "object",
            "properties": {
              "name": {
                "type": "string",
                "description": "The Aspect representing the consequence in this track."
              },
              "description": {
                "description": "A description of the Consequence Aspect, giving a little more context, Markdown allowed.",
                "type": "string"
              },
              "freeInvokes": {
                "type": "number",
                "description": "How many Free Invokes the consequence already has."
              },
              "state": {
                "type": "string",
                "enum": [
                  "free",
                  "used",
                  "recovering"
                ]
              }
            },
            "required": [
              "name",
              "freeInvokes",
              "state"
            ]
          }
        },
        "required": [
          "trackId"
        ]
      }
    },
    "notes": {
      "title": "Notes",
      "description": "Section for notes about the character",
      "type": "array",
      "items": {
        "description": "A line of a multi-text notes field. Supports Markdown",
        "type": "string"
      }
    },
    "tags": {
      "title": "Tags",
      "description": "Arbitrary tags to be applied to the character.",
      "type": "array",
      "items": {
        "title": "Tag",
        "description": "A tag that applies to a character.",
        "type": "string",
        "minLength": 2
      }
    }
  },
  "required": [
    "type",
    "schemaVersion",
    "id",
    "name"
  ]
}