{
  "type": "character",
  "schemaVersion": "1",
  "id": "ikari-kintsugi",
  "name": "Ikari Kintsugi",
  "playerName": "Bea",
  "description": "Young woman in dark attire with gold colored scarring.",
  "campaigns": [
    "one-shot-3"
  ],
  "characterType": "PC",
  "refresh": 3,
  "fatePoints": 3,
  "aspects": [
    {
      "aspectType": "High Concept",
      "name": "Well Connected Pickpocket"
    },
    {
      "aspectType": "Trouble",
      "name": "Abrasive to Authority"
    },
    {
      "aspectType": "Oneshot Reason",
      "name": "Low class serving girl on the Lam",
      "description": "Kintsugi stole some jewelry from Lady Ariana Zanetti, and was lying low in an inn on the road between Alodon and Abilene.\n\nShe was working as a serving girl there when the murder of Lady Charrisse Grant took place."
    },
    {
      "aspectType": "Relationship",
      "name": "Murrieta Owes Me Money"
    }
  ],
  "traitType": "skill",
  "traits": [
    {
      "name": "Burglary",
      "rank": 4
    },
    {
      "name": "Rapport",
      "rank": 3
    },
    {
      "name": "Notice",
      "rank": 3
    }
  ],
  "tracks": [
    {
      "trackId": "stress",
      "trackLabel": "Stress",
      "showSoakAmount": true,
      "boxes": [
        {
          "isUsed": false,
          "soakValue": 1
        },
        {
          "isUsed": false,
          "soakValue": 2
        }
      ]
    },
    {
      "trackId": "consequence-mild",
      "trackLabel": "Mild",
      "showSoakAmount": true,
      "boxes": [
        {
          "isUsed": false,
          "soakValue": 2
        }
      ],
      "aspect": {
        "name": "",
        "freeInvokes": 0,
        "state": "free"
      }
    },
    {
      "trackId": "consequence-moderate",
      "trackLabel": "Moderate",
      "showSoakAmount": true,
      "boxes": [
        {
          "isUsed": false,
          "soakValue": 4
        }
      ],
      "aspect": {
        "name": "",
        "freeInvokes": 0,
        "state": "free"
      }
    },
    {
      "trackId": "consequence-severe",
      "trackLabel": "Severe",
      "showSoakAmount": true,
      "boxes": [
        {
          "isUsed": false,
          "soakValue": 6
        }
      ],
      "aspect": {
        "name": "",
        "freeInvokes": 0,
        "state": "free"
      }
    }
  ],
  "notes": [
    "Known alias: Elise."
  ]
}