{
  "type": "character",
  "schemaVersion": "1",
  "id": "jim-dade",
  "name": "Jim Dade",
  "playerName": "Robert L",
  "campaigns": [
    "campaign-1"
  ],
  "characterType": "PC",
  "description": "Currently morphed to appear as a military grown vat clone. Vat clones look all the same. They look kind of like Lee Majors in his prime.",
  "refresh": 3,
  "fatePoints": 3,
  "aspects": [
    {
      "aspectType": "High Concept",
      "name": "Charismatic cyborg military infiltration scout"
    },
    {
      "aspectType": "Trouble",
      "name": "Hiding from assassins with unknown motivations"
    },
    {
      "name": "Modified Cyber-Heart that requires constant sugar intake"
    },
    {
      "name": "Uses their cover to hide the cold calculations"
    },
    {
      "name": "Dangerous AI-predictive combat reflex responses"
    }
  ],
  "images": [
    {
      "uri": "/images/characters/vat-clones/lee-majors-younger.webp",
      "caption": "Jim Dade"
    },
    {
      "uri": "/images/characters/vat-clones/lee-majors-older.png",
      "caption": "Jim Dade"
    }
  ],
  "traitType": "skill",
  "traits": [
    {
      "name": "Rapport",
      "rank": 4
    },
    {
      "name": "Deceive",
      "rank": 3
    },
    {
      "name": "Notice",
      "rank": 3
    },
    {
      "name": "Burglary",
      "rank": 2
    },
    {
      "name": "Fight",
      "rank": 2
    },
    {
      "name": "Shoot",
      "rank": 2
    },
    {
      "name": "Athletics",
      "rank": 1
    },
    {
      "name": "Drive",
      "rank": 1
    },
    {
      "name": "Investigate",
      "rank": 1
    },
    {
      "name": "Stealth",
      "rank": 1
    }
  ],
  "tracks": [
    {
      "trackId": "stress",
      "trackLabel": "Stress",
      "showSoakAmount": true,
      "boxes": [
        {
          "isUsed": false,
          "soakValue": 1
        },
        {
          "isUsed": false,
          "soakValue": 2
        }
      ]
    },
    {
      "trackId": "consequence-mild",
      "trackLabel": "Mild",
      "showSoakAmount": true,
      "boxes": [
        {
          "isUsed": false,
          "soakValue": 2
        }
      ],
      "aspect": {
        "name": "",
        "freeInvokes": 0,
        "state": "free"
      }
    },
    {
      "trackId": "consequence-moderate",
      "trackLabel": "Moderate",
      "showSoakAmount": true,
      "boxes": [
        {
          "isUsed": false,
          "soakValue": 4
        }
      ],
      "aspect": {
        "name": "",
        "freeInvokes": 0,
        "state": "free"
      }
    },
    {
      "trackId": "consequence-severe",
      "trackLabel": "Severe",
      "showSoakAmount": true,
      "boxes": [
        {
          "isUsed": false,
          "soakValue": 6
        }
      ],
      "aspect": {
        "name": "",
        "freeInvokes": 0,
        "state": "free"
      }
    }
  ],
  "stunts": [
    {
      "schemaVersion": "1",
      "type":  "stunt",
      "name": "Feint",
      "description": "When it looks like you're going to go right, you go left. And vice versa. +2 to create advantages with Deceive that relate to confusion and misdirection in physical combat. (adapted from http://dfrpg-resources.wikispaces.com/Stunts)",
      "mechanics": [
        {
          "mechanicType": "dice-roll",
          "parameters": {
            "trait": "Deceive",
            "modifier": 2,
            "actions": [
              "CaA"
            ],
            "modificationType": "roll"
          }
        }
      ]
    },
    {
      "schemaVersion": "1",
      "type":  "stunt",
      "name": "Hatpin Maestro",
      "description": "You don’t ever have to spend a fate point to declare that you have the proper tools for lockpicking or disabling a device, even in extreme situations (like being imprisoned and separated from all your stuff). This source of opposition is just off the table. (adapted from Spirit of the Century SRD, §6.6.2)"
    },
    {
      "schemaVersion": "1",
      "type":  "stunt",
      "name": "Houdini",
      "description": "You could be found by the police standing next to a burned-down church with a handful of matches and a can of gasoline and still get away scot-free. +2 to Deceive when using it to defend against attempts to discern or prove your involvement in a crime. (adapted from http://dfrpg-resources.wikispaces.com/Stunts)",
      "mechanics": [
        {
          "mechanicType": "dice-roll",
          "parameters": {
            "trait": "Deceive",
            "modifier": 2,
            "actions": [
              "Defend"
            ],
            "modificationType": "roll"
          }
        }
      ]
    }
  ],
  "notes": [
    "#### Biography",
    "",
    "\"Jim\" got mortally wounded and left for dead on a routine scouting mission one day. His company retrieved him. They rebuilt him. They made him better.",
    "It wasn’t a routine mission after all. They could not let the information he gathered die with him. What information? Jim doesn’t know. They had to replace part of his brain. How much? The new \"Jim\" doesn’t really care. All he knows is that his tour has been extended for everyone involved to recoup the costs of saving his life with cybernetic implants.",
    "Now someone has been going around killing off or abducting all the scout infiltrator cyborgs like himself. Who could it be?",
    "",
    "* A division of the military trying to cover up that dangerously buggy combat reflexes they programmed into him?",
    "* Another human government agency?",
    "* A near-humanoid alien agency?",
    "* A rival cybernetics corporation?",
    "* Maybe it’s \"The General\"?",
    "",
    "\"The General\" swooped in, provided Jim with a cover identity (Jim Dade) and a classified codename to get resources. Then \"The General\" ordered him to lie low while they figured all of this out. As a matter of fact, go join this specific ship crew. \"The General\" promises to call and send Jim on missions to investigate who is out to kill off his cybernetics model.",
    "Oh, and \"The General\" still has missions for Jim to complete with orders to, \"try not to expose your real identity or capabilities, okay?\". The only other mission Jim has been sent on (other than joining the current crew) was a pet retrieval mission for \"The General\". Jim kind of suspects he was sent in as a disposable asset on that one.",
    "",
    "#### Inventory",
    "",
    "* Raygun secured in belt holster",
    "* Belt with an over-sized belt-buckle holding up today’s idea of throw-back fashions",
    "* Chest hair",
    "* A cigarette-like case, sized to carry toothpicks",
    "* Comms device, wipes all personal data / app logins over 18 Earth hours old, only retaining ID documents, bank routing and account information",
    "* A bag full of sugary treats",
    "* Winning smile"
  ]
}