{
  "type": "character",
  "schemaVersion": "1",
  "id": "jithal",
  "name": "Jithal",
  "playerName": "Kit",
  "description": "4 armed, eyeless, lamia who sees through radar",
  "campaigns": ["campaign-1"],
  "characterType": "PC",
  "refresh": 3,
  "fatePoints": 3,
  "aspects": [
    {
      "aspectType": "High Concept",
      "name": "Last Grulvaxian Expert Engineer"
    },
    {
      "aspectType": "Trouble",
      "name": "Stranger in a Strange Land"
    },
    {
      "name": "Jithal can fix that"
    },
    {
      "name": "Soft spot for scientists"
    },
    {
      "name": "Charmingly Curious"
    }

  ],
  "traitType": "skill",
  "traits": [
    {
      "name": "Engineering",
      "rank": 4
    },
    {
      "name": "Will",
      "rank": 3
    },
    {
      "name": "Notice",
      "rank": 3
    },
    {
      "name": "Academics",
      "rank": 2
    },
    {
      "name": "Provoke",
      "rank": 2
    },
    {
      "name": "Athletics",
      "rank": 2
    },
    {
      "name": "Pilot",
      "rank": 1
    },
    {
      "name": "Stealth",
      "rank": 1
    },
    {
      "name": "Rapport",
      "rank": 1
    },
    {
      "name": "Investigate",
      "rank": 1
    }
  ],
  "tracks": [
    {
      "trackId": "stress",
      "trackLabel": "Stress",
      "showSoakAmount": true,
      "boxes": [
        {
          "isUsed": false,
          "soakValue": 1
        },
        {
          "isUsed": false,
          "soakValue": 2
        }
      ]
    },
    {
      "trackId": "consequence-mild",
      "trackLabel": "Mild",
      "showSoakAmount": true,
      "boxes": [
        {
          "isUsed": false,
          "soakValue": 2
        }
      ],
      "aspect": {
        "name": "",
        "freeInvokes": 0,
        "state": "free"
      }
    },
    {
      "trackId": "consequence-moderate",
      "trackLabel": "Moderate",
      "showSoakAmount": true,
      "boxes": [
        {
          "isUsed": false,
          "soakValue": 4
        }
      ],
      "aspect": {
        "name": "",
        "freeInvokes": 0,
        "state": "free"
      }
    },
    {
      "trackId": "consequence-severe",
      "trackLabel": "Severe",
      "showSoakAmount": true,
      "boxes": [
        {
          "isUsed": false,
          "soakValue": 6
        }
      ],
      "aspect":{
        "name": "",
        "freeInvokes": 0,
        "state": "free"
      }
    }
  ]
}