{
  "type": "character",
  "schemaVersion": "1",
  "id": "scout-4e0061377",
  "name": "Scout 4e0061377",
  "playerName": "Pete",
  "description": "",
  "campaigns": ["campaign-2"],
  "characterType": "PC",
  "refresh": 3,
  "fatePoints": 3,
  "aspects": [
    {
      "aspectType": "High Concept",
      "name": "War Veteran Recon Clone that Lives to Recon"
    },
    {
      "aspectType": "Trouble",
      "name": "I Haven't Found Satisfaction in Other Tasks"
    },
    {
      "name": "I Don't Like Having to Learn New Things"
    },
    {
      "name": "I am good at telling if non-vat-clones are lying"
    }
  ],
  "images": [
    {
      "uri": "/images/characters/vat-clones/sigourney-weaver-aliens.jpg",
      "caption":"Scout hunting."
    },
    {
      "uri": "/images/characters/vat-clones/sigourney-weaver-alien3.jpg",
      "caption": "Scout making a report after a tough recon behind enemy lines."
    },
    {
      "uri": "/images/characters/vat-clones/sigourney-weaver-galaxy-quest.jpg",
      "caption": "Scout undercover as a communications officer, and not enjoying it."
    },
    {
      "uri": "/images/characters/vat-clones/lee-majors-older.png",
      "caption":"Scout in deep undercover with extensive plastic surgery."
    }
  ],
  "traitType": "skill",
  "traits": [
    {
      "name": "Stealth",
      "rank": 4
    },
    {
      "name": "Physique",
      "rank": 3
    },
    {
      "name": "Notice",
      "rank": 3
    },
    {
      "name": "Rapport",
      "rank": 2
    },
    {
      "name": "Athletics",
      "rank": 2
    },
    {
      "name": "Fight",
      "rank": 2
    },
    {
      "name": "Empathy",
      "rank": 1
    },
    {
      "name": "Provoke",
      "rank": 1
    },
    {
      "name": "Shoot",
      "rank": 1
    }
  ],
  "tracks": [
    {
      "trackId": "stress",
      "trackLabel": "Stress",
      "showSoakAmount": true,
      "boxes": [
        {
          "isUsed": false,
          "soakValue": 1
        },
        {
          "isUsed": false,
          "soakValue": 2
        }
      ]
    },
    {
      "trackId": "consequence-mild",
      "trackLabel": "Mild",
      "showSoakAmount": true,
      "boxes": [
        {
          "isUsed": false,
          "soakValue": 2
        }
      ],
      "aspect": {
        "name": "",
        "freeInvokes": 0,
        "state": "free"
      }
    },
    {
      "trackId": "consequence-moderate",
      "trackLabel": "Moderate",
      "showSoakAmount": true,
      "boxes": [
        {
          "isUsed": false,
          "soakValue": 4
        }
      ],
      "aspect": {
        "name": "",
        "freeInvokes": 0,
        "state": "free"
      }
    },
    {
      "trackId": "consequence-severe",
      "trackLabel": "Severe",
      "showSoakAmount": true,
      "boxes": [
        {
          "isUsed": false,
          "soakValue": 6
        }
      ],
      "aspect":{
        "name": "",
        "freeInvokes": 0,
        "state": "free"
      }
    }
  ]
}