{
  "type": "character",
  "schemaVersion": "1",
  "id": "fria-sun",
  "name": "Fria Sun",
  "playerName": "Jon T",
  "description": "A vat clone variant based on Linda Hamilton",
  "campaigns": ["one-shot-4"],
  "characterType": "PC",
  "refresh": 3,
  "fatePoints": 3,
  "aspects": [
    {
      "aspectType": "High Concept",
      "name": "Vat Clone Combat Medic"
    },
    {
      "aspectType": "Trouble",
      "name": "Clones Are NOT Disposable",
      "description": "She's got a chip on her shoulder at any insinuation that clones are less than human."
    },
    {
      "aspectType": "Oneshot Reason",
      "name": "Private Security, Secret Physician"
    }

  ],
  "images": [
    {
      "uri": "/images/characters/vat-clones/linda-hamilton.jpg",
      "caption": "Taking five."
    }
  ],
  "traitType": "skill",
  "traits": [
    {
      "name": "Shoot",
      "rank": 4
    },
    {
      "name": "Academics",
      "rank": 3
    },
    {
      "name": "Provoke",
      "rank": 3
    },
    {
      "name": "Stealth",
      "rank": 2
    }
  ],
  "stunts": [
    {
      "schemaVersion": "1",
      "type":  "stunt",
      "name": "Anti-Slavery",
      "description": "Because of ***the way most  sapients treat vat clones***, I get +2 to Attack with Shoot to prevent someone being enslaved.",
      "mechanics": [
        {
          "mechanicType": "dice-roll",
          "parameters": {
            "trait": "Shoot",
            "modifier": 2,
            "actions": [
              "Attack"
            ]
          }
        }
      ]
    }
  ],
  "tracks": [
    {
      "trackId": "stress",
      "trackLabel": "Stress",
      "showSoakAmount": true,
      "boxes": [
        {
          "isUsed": false,
          "soakValue": 1
        },
        {
          "isUsed": false,
          "soakValue": 2
        }
      ]
    },
    {
      "trackId": "consequence-mild",
      "trackLabel": "Mild",
      "showSoakAmount": true,
      "boxes": [
        {
          "isUsed": false,
          "soakValue": 2
        }
      ],
      "aspect": {
        "name": "",
        "freeInvokes": 0,
        "state": "free"
      }
    },
    {
      "trackId": "consequence-moderate",
      "trackLabel": "Moderate",
      "showSoakAmount": true,
      "boxes": [
        {
          "isUsed": false,
          "soakValue": 4
        }
      ],
      "aspect": {
        "name": "",
        "freeInvokes": 0,
        "state": "free"
      }
    },
    {
      "trackId": "consequence-severe",
      "trackLabel": "Severe",
      "showSoakAmount": true,
      "boxes": [
        {
          "isUsed": false,
          "soakValue": 6
        }
      ],
      "aspect":{
        "name": "",
        "freeInvokes": 0,
        "state": "free"
      }
    }
  ],
  "notes": [
    "Fria Sun is a vat clone, a war veteran, one of the few to get advanced medical training (it's usually cheaper to grow new after too much damage).\n\n",
    "On the surface she's just another ex-soldier working in private security - but secretly, her primary clientele are those of the rich and powerful hiding serious medical conditions, who want an \"off the books\" physician on hand at all times.\n",
    "#### Load out for Straitgate missions:",
    "* Semi-auto laser AR-15",
    "* Pistol (Slugthrower, Semiautomatic)",
    "* Combat/Utility Knife",
    "* Body armour / vacuum ready",
    "* Medic Pack"
  ]
}