{
  "type": "character",
  "schemaVersion": "1",
  "id": "delilah",
  "name": "Delilah \"Deli\" Land",
  "playerName": "Bea",
  "description": "",
  "campaigns": ["campaign-2"],
  "characterType": "PC",
  "refresh": 3,
  "fatePoints": 3,
  "aspects": [
    {
      "aspectType": "High Concept",
      "name": "Transhuman Transgender Engineer"
    },
    {
      "aspectType": "Trouble",
      "name": ""
    }

  ],
  "traitType": "skill",
  "traits": [
    {
      "name": "Engineering",
      "rank": 4
    },
    {
      "name": "Rapport",
      "rank": 3
    },
    {
      "name": "Notice",
      "rank": 3
    }
  ],
  "tracks": [
    {
      "trackId": "stress",
      "trackLabel": "Stress",
      "showSoakAmount": true,
      "boxes": [
        {
          "isUsed": false,
          "soakValue": 1
        },
        {
          "isUsed": false,
          "soakValue": 2
        }
      ]
    },
    {
      "trackId": "consequence-mild",
      "trackLabel": "Mild",
      "showSoakAmount": true,
      "boxes": [
        {
          "isUsed": false,
          "soakValue": 2
        }
      ],
      "aspect": {
        "name": "",
        "freeInvokes": 0,
        "state": "free"
      }
    },
    {
      "trackId": "consequence-moderate",
      "trackLabel": "Moderate",
      "showSoakAmount": true,
      "boxes": [
        {
          "isUsed": false,
          "soakValue": 4
        }
      ],
      "aspect": {
        "name": "",
        "freeInvokes": 0,
        "state": "free"
      }
    },
    {
      "trackId": "consequence-severe",
      "trackLabel": "Severe",
      "showSoakAmount": true,
      "boxes": [
        {
          "isUsed": false,
          "soakValue": 6
        }
      ],
      "aspect":{
        "name": "",
        "freeInvokes": 0,
        "state": "free"
      }
    }
  ]
}