{
  "type": "character",
  "schemaVersion": "1",
  "id": "0",
  "name": "Joe Sample",
  "description": "Joe is a simple guy, trying to be a good man in a hard world.",
  "refresh": 3,
  "fatePoints": 3,
  "aspects": [
    {
      "aspectType": "High Concept",
      "name": "Protagonist for Pay",
      "description": "Joe is an ex-cop who now works as a Private Investigator and is definitely the hero of his own story."
    },
    {
      "aspectType": "Trouble",
      "name": "Too good for this world",
      "description": "Joe will do the right thing even though it turns out very badly for him."
    },
    {
      "aspectType": "Relationship",
      "name": "Must reconnect with my estranged daughter Emily",
      "description": "Joe's adult daughter Emily lives in the City but does not want contact with her father. She was raised by her mother after she divorced Joe because of his extreme work ethic and for fear of losing him to the dangers of his job."
    },
    {
      "name": "Custom tuned 1969 Mustang Mach 1"
    },
    {
      "name": "Carla's the best partner a man can have."
    }
  ],
  "traitType": "skill",
  "traits": [
    {
      "name": "Notice",
      "rank": 4
    },
    {
      "name": "Shoot",
      "rank": 3
    },
    {
      "name": "Empathy",
      "rank": 3
    },
    {
      "name": "Will",
      "rank": 2
    },
    {
      "name": "Athletics",
      "rank": 2
    },
    {
      "name": "Investigate",
      "rank": 2
    },
    {
      "name": "Fight",
      "rank": 1
    },
    {
      "name": "Physique",
      "rank": 1
    },
    {
      "name": "Drive",
      "rank": 1
    },
    {
      "name": "Resources",
      "rank": 1
    }
  ],
  "stunts": [
    {
      "name": "Resolute",
      "description": "In order to steel myself to action, I get +2 to a Will roll to Create an Advantage representing my decision to follow through on that action. The Aspect created can be used to resist efforts to stop me completing the action.",
      "parameters": {
        "trait": "Will",
        "modifier": 2,
        "actions": ["CaA"]
      }
    }
  ]
}