{
  "type": "character",
  "schemaVersion": "1",
  "id": "kiowynne",
  "name": "Kiowynne",
  "playerName": "Anne",
  "description": "Tall for a human woman, long black braided hair, deep tan, lots of gold jewelry.\n\nRed long coat, black, brown & gold vest, black cargo pants, combat boots.\n\nWeapon hidden under coat.",
  "campaigns": [
    "campaign-2"
  ],
  "characterType": "PC",
  "refresh": 3,
  "fatePoints": 3,
  "aspects": [
    {
      "aspectType": "High Concept",
      "name": "Unflappable Badass"
    },
    {
      "aspectType": "Trouble",
      "name": "Can't say no to a pretty face"
    },
    {
      "name": "Collects strays"
    }
  ],
  "traitType": "skill",
  "traits": [
    {
      "name": "Shoot",
      "rank": 4
    },
    {
      "name": "Fight",
      "rank": 3
    },
    {
      "name": "Provoke",
      "rank": 3
    },
    {
      "name": "Empathy",
      "rank": 2
    },
    {
      "name": "Contacts",
      "rank": 2
    },
    {
      "name": "Notice",
      "rank": 2
    }
  ],
  "stunts": [
    {
      "schemaVersion": "1",
      "type":  "stunt",
      "name": "Always looking for Danger",
      "description": "Because I've been in many situations where hidden weapons have put my life in danger, I have learned to spot them, and I get +2 on Notice Overcome rolls to identify when a character has hidden a weapon on themself.",
      "mechanics": [
        {
          "mechanicType": "dice-roll",
          "parameters": {
            "trait": "Notice",
            "modifier": 2,
            "actions": [
              "Overcome"
            ],
            "modificationType": "roll"
          }
        }
      ]
    }
  ],
  "tracks": [
    {
      "trackId": "stress",
      "trackLabel": "Stress",
      "showSoakAmount": true,
      "boxes": [
        {
          "isUsed": false,
          "soakValue": 1
        },
        {
          "isUsed": false,
          "soakValue": 2
        }
      ]
    },
    {
      "trackId": "consequence-mild",
      "trackLabel": "Mild",
      "showSoakAmount": true,
      "boxes": [
        {
          "isUsed": false,
          "soakValue": 2
        }
      ],
      "aspect": {
        "name": "",
        "freeInvokes": 0,
        "state": "free"
      }
    },
    {
      "trackId": "consequence-moderate",
      "trackLabel": "Moderate",
      "showSoakAmount": true,
      "boxes": [
        {
          "isUsed": false,
          "soakValue": 4
        }
      ],
      "aspect": {
        "name": "",
        "freeInvokes": 0,
        "state": "free"
      }
    },
    {
      "trackId": "consequence-severe",
      "trackLabel": "Severe",
      "showSoakAmount": true,
      "boxes": [
        {
          "isUsed": false,
          "soakValue": 6
        }
      ],
      "aspect": {
        "name": "",
        "freeInvokes": 0,
        "state": "free"
      }
    }
  ]
}