{
  "type": "character",
  "schemaVersion": "1",
  "id": "delilah",
  "name": "Delilah \"Deli\" Lands",
  "playerName": "Bea",
  "description": "",
  "campaigns": ["campaign-2"],
  "characterType": "PC",
  "refresh": 3,
  "fatePoints": 3,
  "aspects": [
    {
      "aspectType": "High Concept",
      "name": "Transhuman Transgender Engineer",
      "description": "* Voice synth/modulation\n* Equipment compartments\n* Recording software\n* Advanced audio/visual sensors\n* Oxygen recycler\n* Integrated smart phone/computer for communications"
    },
    {
      "aspectType": "Trouble",
      "name": "Cyborg \"Menace\"",
      "description": "To be clear, Delilah is not a cyborg menace; she just has to deal with humans who think that she is."
    },
    {
      "name": "God Damn Chairs",
      "description": "Delilah's 10 foot long body does not allow her to be comfortable in most human sized spaces.\n\nFor example, Delilah must coil up in the cargo section of the space elevator when she travels the planet."
    },
    {
      "name": "Doesn't Hold Grudges"
    },
    {
      "name": "People Pleaser"
    }
  ],
  "traitType": "skill",
  "traits": [
    {
      "name": "Engineering",
      "rank": 4
    },
    {
      "name": "Rapport",
      "rank": 3
    },
    {
      "name": "Notice",
      "rank": 3
    },
    {
      "name": "Physique",
      "rank": 2
    },
    {
      "name": "Empathy",
      "rank": 2
    },
    {
      "name": "Provoke",
      "rank": 2
    },
    {
      "name": "Shoot",
      "rank": 1
    },
    {
      "name": "Pilot",
      "rank": 1
    }
  ],
  "stunts": [
    {
      "schemaVersion": "1",
      "type":  "stunt",
      "name": "Restraint Protocols",
      "description": "Because ***I have programmed my multiple robotic arms and other limbs to do so***, I can use _Engineering_ instead of _Fight_ to Grapple Opponents in a Conflict"
    },
    {
      "schemaVersion": "1",
      "type":  "stunt",
      "name": "Cybernetic metal is tougher than your average bear",
      "description": "Because I have an enormous metal cybernetic body, I get an extra Mild (2) Consequence slot that can only be used for physical consequences.",
      "mechanics": [
        {
          "mechanicType": "add-consequence",
          "parameters": {
            "consequenceLevel": "mild",
            "trackLabel": "Mild (Phys)"
          }
        }
      ]
    },
    {
      "schemaVersion": "1",
      "type":  "stunt",
      "name": "Self-Repair Protocol",
      "description": "Because ***I've engineered my own cyberbody with knowledge on how to fix itself***, I can reduce a moderate injury to a mild,"
    }
  ],
  "tracks": [
    {
      "trackId": "stress",
      "trackLabel": "Stress",
      "showSoakAmount": true,
      "boxes": [
        {
          "isUsed": false,
          "soakValue": 1
        },
        {
          "isUsed": false,
          "soakValue": 2
        }
      ]
    },
    {
      "trackId": "consequence-mild",
      "trackLabel": "Mild",
      "showSoakAmount": true,
      "boxes": [
        {
          "isUsed": false,
          "soakValue": 2
        }
      ],
      "aspect": {
        "name": "",
        "freeInvokes": 0,
        "state": "free"
      }
    },
    {
      "trackId": "consequence-mild",
      "trackLabel": "Mild (Phys)",
      "showSoakAmount": true,
      "boxes": [
        {
          "isUsed": false,
          "soakValue": 2
        }
      ],
      "aspect": {
        "name": "",
        "freeInvokes": 0,
        "state": "free"
      }
    },
    {
      "trackId": "consequence-moderate",
      "trackLabel": "Moderate",
      "showSoakAmount": true,
      "boxes": [
        {
          "isUsed": false,
          "soakValue": 4
        }
      ],
      "aspect": {
        "name": "",
        "freeInvokes": 0,
        "state": "free"
      }
    },
    {
      "trackId": "consequence-severe",
      "trackLabel": "Severe",
      "showSoakAmount": true,
      "boxes": [
        {
          "isUsed": false,
          "soakValue": 6
        }
      ],
      "aspect":{
        "name": "",
        "freeInvokes": 0,
        "state": "free"
      }
    }
  ]
}